{
  "$schema": "https://json-schema.org/draft/2020-12/schema",
  "$id": "news.schema.json",
  "title": "News snapshot",
  "description": "data/raw/news/YYYY-MM-DDTHH.json (UTC hour of the fetch): headlines that name a candidate, from the feeds in config/sources.yaml, not seen in an earlier snapshot. Titles and links only.",
  "type": "object",
  "additionalProperties": false,
  "required": ["schema_version", "fetched_at", "feeds", "items"],
  "properties": {
    "schema_version": { "const": "1.0" },
    "fetched_at": { "$ref": "#/$defs/timestamp" },
    "feeds": {
      "type": "array",
      "items": {
        "type": "object",
        "additionalProperties": false,
        "required": ["id", "status", "items", "error"],
        "properties": {
          "id": { "type": "string", "pattern": "^[a-z0-9][a-z0-9-]*$" },
          "status": { "enum": ["ok", "error"] },
          "items": { "type": "integer", "minimum": 0, "description": "Items in the feed, matched or not." },
          "error": { "type": ["string", "null"] }
        }
      }
    },
    "items": {
      "type": "array",
      "items": {
        "type": "object",
        "additionalProperties": false,
        "required": ["feed", "title", "url", "published_at", "candidate_ids"],
        "properties": {
          "feed": { "type": "string", "pattern": "^[a-z0-9][a-z0-9-]*$" },
          "title": { "type": "string", "minLength": 1, "maxLength": 500 },
          "url": { "type": "string", "pattern": "^https?://" },
          "published_at": { "oneOf": [{ "$ref": "#/$defs/timestamp" }, { "type": "null" }] },
          "candidate_ids": {
            "type": "array",
            "minItems": 1,
            "uniqueItems": true,
            "items": { "type": "string", "pattern": "^[a-z][a-z0-9_]*$" }
          }
        }
      }
    }
  },
  "$defs": {
    "timestamp": { "type": "string", "pattern": "^\\d{4}-\\d{2}-\\d{2}T\\d{2}:\\d{2}:\\d{2}Z$" }
  }
}
