{
  "feeds": [
    {
      "error": null,
      "id": "lemonde-presidentielle",
      "items": 20,
      "status": "ok"
    },
    {
      "error": null,
      "id": "lemonde-politique",
      "items": 20,
      "status": "ok"
    },
    {
      "error": null,
      "id": "lefigaro-politique",
      "items": 20,
      "status": "ok"
    },
    {
      "error": null,
      "id": "lefigaro-elections",
      "items": 20,
      "status": "ok"
    },
    {
      "error": null,
      "id": "liberation-politique",
      "items": 50,
      "status": "ok"
    },
    {
      "error": null,
      "id": "franceinfo-politique",
      "items": 20,
      "status": "ok"
    },
    {
      "error": null,
      "id": "franceinfo-presidentielle",
      "items": 20,
      "status": "ok"
    },
    {
      "error": null,
      "id": "bfmtv-politique",
      "items": 30,
      "status": "ok"
    },
    {
      "error": null,
      "id": "bfmtv-presidentielle",
      "items": 30,
      "status": "ok"
    },
    {
      "error": null,
      "id": "leparisien-politique",
      "items": 100,
      "status": "ok"
    },
    {
      "error": null,
      "id": "20minutes-politique",
      "items": 20,
      "status": "ok"
    },
    {
      "error": null,
      "id": "publicsenat",
      "items": 60,
      "status": "ok"
    },
    {
      "error": null,
      "id": "france24-france",
      "items": 30,
      "status": "ok"
    }
  ],
  "fetched_at": "2026-10-29T13:18:11Z",
  "items": [
    {
      "candidate_ids": [
        "lisnard"
      ],
      "feed": "leparisien-politique",
      "published_at": null,
      "title": "« Camps d’entraînement terroristes » : des élus du plateau de Millevaches exigent la démission de David Lisnard de l’AMF après ses propos",
      "url": "https://www.leparisien.fr/politique/camps-dentrainement-terroristes-des-elus-du-plateau-de-millevaches-exigent-la-demission-de-david-lisnard-de-lamf-apres-ses-propos-29-10-2026-3VOTZ7MNH5CQFPJJZUCDTGVEWA.php"
    },
    {
      "candidate_ids": [
        "tondelier"
      ],
      "feed": "leparisien-politique",
      "published_at": null,
      "title": "Présidentielle 2027 : post-partum, allaitement, insultes… Marine Tondelier se confie sur son nouveau quotidien de mère",
      "url": "https://www.leparisien.fr/politique/presidentielle-2027-post-partum-allaitement-insultes-marine-tondelier-se-confie-sur-son-nouveau-quotidien-de-mere-29-10-2026-4WWMFIETJJEQDFXRM7AVDVVLO4.php"
    }
  ],
  "schema_version": "1.0"
}
