{
  "feeds": [
    {
      "error": null,
      "id": "lemonde-presidentielle",
      "items": 20,
      "status": "ok"
    },
    {
      "error": null,
      "id": "lemonde-politique",
      "items": 20,
      "status": "ok"
    },
    {
      "error": null,
      "id": "lefigaro-politique",
      "items": 20,
      "status": "ok"
    },
    {
      "error": null,
      "id": "lefigaro-elections",
      "items": 20,
      "status": "ok"
    },
    {
      "error": null,
      "id": "liberation-politique",
      "items": 50,
      "status": "ok"
    },
    {
      "error": null,
      "id": "franceinfo-politique",
      "items": 20,
      "status": "ok"
    },
    {
      "error": null,
      "id": "franceinfo-presidentielle",
      "items": 20,
      "status": "ok"
    },
    {
      "error": null,
      "id": "bfmtv-politique",
      "items": 30,
      "status": "ok"
    },
    {
      "error": null,
      "id": "bfmtv-presidentielle",
      "items": 30,
      "status": "ok"
    },
    {
      "error": null,
      "id": "leparisien-politique",
      "items": 100,
      "status": "ok"
    },
    {
      "error": null,
      "id": "20minutes-politique",
      "items": 20,
      "status": "ok"
    },
    {
      "error": null,
      "id": "publicsenat",
      "items": 60,
      "status": "ok"
    },
    {
      "error": null,
      "id": "france24-france",
      "items": 30,
      "status": "ok"
    }
  ],
  "fetched_at": "2026-10-31T17:18:25Z",
  "items": [],
  "schema_version": "1.0"
}
