{
  "feeds": [
    {
      "error": null,
      "id": "lemonde-presidentielle",
      "items": 20,
      "status": "ok"
    },
    {
      "error": null,
      "id": "lemonde-politique",
      "items": 20,
      "status": "ok"
    },
    {
      "error": null,
      "id": "lefigaro-politique",
      "items": 20,
      "status": "ok"
    },
    {
      "error": null,
      "id": "lefigaro-elections",
      "items": 20,
      "status": "ok"
    },
    {
      "error": null,
      "id": "liberation-politique",
      "items": 50,
      "status": "ok"
    },
    {
      "error": null,
      "id": "franceinfo-politique",
      "items": 20,
      "status": "ok"
    },
    {
      "error": null,
      "id": "franceinfo-presidentielle",
      "items": 20,
      "status": "ok"
    },
    {
      "error": null,
      "id": "bfmtv-politique",
      "items": 30,
      "status": "ok"
    },
    {
      "error": null,
      "id": "bfmtv-presidentielle",
      "items": 30,
      "status": "ok"
    },
    {
      "error": null,
      "id": "leparisien-politique",
      "items": 100,
      "status": "ok"
    },
    {
      "error": null,
      "id": "20minutes-politique",
      "items": 20,
      "status": "ok"
    },
    {
      "error": null,
      "id": "publicsenat",
      "items": 60,
      "status": "ok"
    },
    {
      "error": null,
      "id": "france24-france",
      "items": 30,
      "status": "ok"
    }
  ],
  "fetched_at": "2026-10-24T07:18:16Z",
  "items": [
    {
      "candidate_ids": [
        "le_pen"
      ],
      "feed": "bfmtv-politique",
      "published_at": "2026-10-24T07:11:00Z",
      "title": "\"On a le vent de face mais on est reste ultra-favori\": un congrès du RN sous haute tension à Orléans, Marine Le Pen en position de force",
      "url": "https://www.bfmtv.com/politique/front-national/on-a-le-vent-de-face-mais-on-est-reste-ultra-favori-un-congres-du-rn-sous-haute-tension-a-orleans-marine-le-pen-en-position-de-force_AN-202610240047.html"
    }
  ],
  "schema_version": "1.0"
}
