{
  "feeds": [
    {
      "error": null,
      "id": "lemonde-presidentielle",
      "items": 20,
      "status": "ok"
    },
    {
      "error": null,
      "id": "lemonde-politique",
      "items": 20,
      "status": "ok"
    },
    {
      "error": null,
      "id": "lefigaro-politique",
      "items": 20,
      "status": "ok"
    },
    {
      "error": null,
      "id": "lefigaro-elections",
      "items": 20,
      "status": "ok"
    },
    {
      "error": null,
      "id": "liberation-politique",
      "items": 50,
      "status": "ok"
    },
    {
      "error": null,
      "id": "franceinfo-politique",
      "items": 20,
      "status": "ok"
    },
    {
      "error": null,
      "id": "franceinfo-presidentielle",
      "items": 20,
      "status": "ok"
    },
    {
      "error": null,
      "id": "bfmtv-politique",
      "items": 30,
      "status": "ok"
    },
    {
      "error": null,
      "id": "bfmtv-presidentielle",
      "items": 30,
      "status": "ok"
    },
    {
      "error": null,
      "id": "leparisien-politique",
      "items": 100,
      "status": "ok"
    },
    {
      "error": null,
      "id": "20minutes-politique",
      "items": 20,
      "status": "ok"
    },
    {
      "error": null,
      "id": "publicsenat",
      "items": 60,
      "status": "ok"
    },
    {
      "error": null,
      "id": "france24-france",
      "items": 30,
      "status": "ok"
    }
  ],
  "fetched_at": "2026-10-25T20:19:10Z",
  "items": [
    {
      "candidate_ids": [
        "bardella",
        "le_pen"
      ],
      "feed": "liberation-politique",
      "published_at": "2026-10-25T19:20:58Z",
      "title": "A Orléans, Marine Le Pen sort la carte «optimisme» pour relancer sa campagne présidentielle",
      "url": "https://www.liberation.fr/politique/a-orleans-marine-le-pen-sort-la-carte-optimisme-pour-relancer-sa-campagne-presidentielle-20261025_NS2ZHVO2KZHHJOIRM464LR3VGU/"
    },
    {
      "candidate_ids": [
        "glucksmann",
        "le_pen"
      ],
      "feed": "franceinfo-presidentielle",
      "published_at": "2026-10-25T19:36:02Z",
      "title": "Présidentielle 2027 : Marine Le Pen lance sa campagne, manifestations, Raphaël Glucksmann à Amiens... Le point sur la semaine",
      "url": "https://www.franceinfo.fr/elections/presidentielle/presidentielle-2027-marine-le-pen-lance-sa-campagne-manifestations-raphael-glucksmann-a-amiens-le-point-sur-la-semaine_8253493.html"
    },
    {
      "candidate_ids": [
        "le_pen",
        "melenchon"
      ],
      "feed": "20minutes-politique",
      "published_at": "2026-10-25T19:59:00Z",
      "title": "Présidentielle 2027 : La renaissance pour Marine Le Pen, Mélenchon au second tour, Nicolas Hulot rhabillé pour l’hiver",
      "url": "https://www.20minutes.fr/politique/4257372-20261025-presidentielle-2027-renaissance-marine-pen-melenchon-second-tour-nicolas-hulot-rhabille-hiver"
    },
    {
      "candidate_ids": [
        "le_pen"
      ],
      "feed": "publicsenat",
      "published_at": "2026-10-25T18:59:21Z",
      "title": "À Orléans, l’éloge du beau de Marine Le Pen tranche avec les échauffourées en tribune et l’expulsion de journalistes",
      "url": "https://www.publicsenat.fr/actualites/politique/a-orleans-leloge-du-beau-de-marine-le-pen-tranche-avec-les-echauffourees-en-tribune-et-lexpulsion-de-journalistes"
    },
    {
      "candidate_ids": [
        "le_pen"
      ],
      "feed": "publicsenat",
      "published_at": "2026-10-25T18:18:35Z",
      "title": "Si elle gagne en 2027, Marine Le Pen appelle à la formation d’un « gouvernement d’Union Nationale »",
      "url": "https://www.publicsenat.fr/actualites/politique/si-elle-gagne-en-2027-marine-le-pen-appelle-a-la-formation-dun-gouvernement-dunion-nationale"
    }
  ],
  "schema_version": "1.0"
}
