{
  "feeds": [
    {
      "error": null,
      "id": "lemonde-presidentielle",
      "items": 20,
      "status": "ok"
    },
    {
      "error": null,
      "id": "lemonde-politique",
      "items": 20,
      "status": "ok"
    },
    {
      "error": null,
      "id": "lefigaro-politique",
      "items": 20,
      "status": "ok"
    },
    {
      "error": null,
      "id": "lefigaro-elections",
      "items": 20,
      "status": "ok"
    },
    {
      "error": null,
      "id": "liberation-politique",
      "items": 50,
      "status": "ok"
    },
    {
      "error": null,
      "id": "franceinfo-politique",
      "items": 20,
      "status": "ok"
    },
    {
      "error": null,
      "id": "franceinfo-presidentielle",
      "items": 19,
      "status": "ok"
    },
    {
      "error": null,
      "id": "bfmtv-politique",
      "items": 30,
      "status": "ok"
    },
    {
      "error": null,
      "id": "bfmtv-presidentielle",
      "items": 30,
      "status": "ok"
    },
    {
      "error": null,
      "id": "leparisien-politique",
      "items": 100,
      "status": "ok"
    },
    {
      "error": null,
      "id": "20minutes-politique",
      "items": 20,
      "status": "ok"
    },
    {
      "error": null,
      "id": "publicsenat",
      "items": 60,
      "status": "ok"
    },
    {
      "error": null,
      "id": "france24-france",
      "items": 30,
      "status": "ok"
    }
  ],
  "fetched_at": "2026-10-16T19:12:32Z",
  "items": [
    {
      "candidate_ids": [
        "le_pen"
      ],
      "feed": "bfmtv-politique",
      "published_at": "2026-10-16T19:09:12Z",
      "title": "Présidentielle: \"Marine Le Pen souhaite un vote d'adhésion\", explique Jean-Philippe Tanguy, député RN",
      "url": "https://www.bfmtv.com/politique/elections/presidentielle/video-presidentielle-marine-le-pen-souhaite-un-vote-d-adhesion-explique-jean-philippe-tanguy-depute-rn_VN-202610160812.html"
    },
    {
      "candidate_ids": [
        "le_pen"
      ],
      "feed": "bfmtv-politique",
      "published_at": "2026-10-16T18:42:35Z",
      "title": "Conseil constitutionnel: les parlementaires RN réclament la démission de Richard Ferrand",
      "url": "https://www.bfmtv.com/politique/front-national/video-conseil-constitutionnel-les-parlementaires-rn-reclament-la-demission-de-richard-ferrand_VN-202610160796.html"
    },
    {
      "candidate_ids": [
        "arthaud"
      ],
      "feed": "bfmtv-politique",
      "published_at": "2026-10-16T18:30:08Z",
      "title": "Mobilisation du 17 octobre: \"Les plus grands casseurs sont au gouvernement\", scande Nathalie Arthaud",
      "url": "https://www.bfmtv.com/politique/video-mobilisation-du-17-octobre-les-plus-grands-casseurs-sont-au-gouvernement-scande-nathalie-arthaud_VN-202610160791.html"
    },
    {
      "candidate_ids": [
        "arthaud"
      ],
      "feed": "bfmtv-politique",
      "published_at": "2026-10-16T18:22:44Z",
      "title": "Mobilisation du 17 octobre: \"Les plus grands casseurs sont au gouvernement\", affirme Nathalie Arthaud (Lutte Ouvrière)",
      "url": "https://www.bfmtv.com/politique/video-mobilisation-du-17-octobre-les-plus-grands-casseurs-sont-au-gouvernement-affirme-nathalie-arthaud-lutte-ouvriere_VN-202610160785.html"
    }
  ],
  "schema_version": "1.0"
}
