{
  "feeds": [
    {
      "error": null,
      "id": "lemonde-presidentielle",
      "items": 20,
      "status": "ok"
    },
    {
      "error": null,
      "id": "lemonde-politique",
      "items": 20,
      "status": "ok"
    },
    {
      "error": null,
      "id": "lefigaro-politique",
      "items": 20,
      "status": "ok"
    },
    {
      "error": null,
      "id": "lefigaro-elections",
      "items": 20,
      "status": "ok"
    },
    {
      "error": null,
      "id": "liberation-politique",
      "items": 50,
      "status": "ok"
    },
    {
      "error": null,
      "id": "franceinfo-politique",
      "items": 20,
      "status": "ok"
    },
    {
      "error": null,
      "id": "franceinfo-presidentielle",
      "items": 20,
      "status": "ok"
    },
    {
      "error": null,
      "id": "bfmtv-politique",
      "items": 30,
      "status": "ok"
    },
    {
      "error": null,
      "id": "bfmtv-presidentielle",
      "items": 30,
      "status": "ok"
    },
    {
      "error": null,
      "id": "leparisien-politique",
      "items": 100,
      "status": "ok"
    },
    {
      "error": null,
      "id": "20minutes-politique",
      "items": 20,
      "status": "ok"
    },
    {
      "error": null,
      "id": "publicsenat",
      "items": 60,
      "status": "ok"
    },
    {
      "error": null,
      "id": "france24-france",
      "items": 30,
      "status": "ok"
    }
  ],
  "fetched_at": "2026-10-29T15:18:21Z",
  "items": [
    {
      "candidate_ids": [
        "philippe"
      ],
      "feed": "lemonde-politique",
      "published_at": "2026-10-29T14:59:13Z",
      "title": "Anticor se constitue partie civile dans l’enquête sur Edouard Philippe",
      "url": "https://www.lemonde.fr/societe/article/2026/10/29/anticor-se-constitue-partie-civile-dans-l-enquete-sur-edouard-philippe_6802341_3224.html"
    },
    {
      "candidate_ids": [
        "attal",
        "villepin"
      ],
      "feed": "leparisien-politique",
      "published_at": null,
      "title": "Présidentielle 2027 : « On les a gentiment éconduits », Dominique de Villepin a refusé la proposition de Gabriel Attal de prendre part à une primaire",
      "url": "https://www.leparisien.fr/politique/presidentielle-2027-on-les-a-gentiment-econduits-dominique-de-villepin-a-refuse-la-proposition-de-gabriel-attal-de-prendre-part-a-une-primaire-29-10-2026-WBVFHMQZOBCP3KRVJREI6GXGGE.php"
    }
  ],
  "schema_version": "1.0"
}
