{
  "feeds": [
    {
      "error": null,
      "id": "lemonde-presidentielle",
      "items": 20,
      "status": "ok"
    },
    {
      "error": null,
      "id": "lemonde-politique",
      "items": 20,
      "status": "ok"
    },
    {
      "error": null,
      "id": "lefigaro-politique",
      "items": 20,
      "status": "ok"
    },
    {
      "error": null,
      "id": "lefigaro-elections",
      "items": 20,
      "status": "ok"
    },
    {
      "error": null,
      "id": "liberation-politique",
      "items": 50,
      "status": "ok"
    },
    {
      "error": null,
      "id": "franceinfo-politique",
      "items": 20,
      "status": "ok"
    },
    {
      "error": null,
      "id": "franceinfo-presidentielle",
      "items": 20,
      "status": "ok"
    },
    {
      "error": null,
      "id": "bfmtv-politique",
      "items": 30,
      "status": "ok"
    },
    {
      "error": null,
      "id": "bfmtv-presidentielle",
      "items": 30,
      "status": "ok"
    },
    {
      "error": null,
      "id": "leparisien-politique",
      "items": 100,
      "status": "ok"
    },
    {
      "error": null,
      "id": "20minutes-politique",
      "items": 20,
      "status": "ok"
    },
    {
      "error": null,
      "id": "publicsenat",
      "items": 60,
      "status": "ok"
    },
    {
      "error": null,
      "id": "france24-france",
      "items": 30,
      "status": "ok"
    }
  ],
  "fetched_at": "2026-10-23T13:18:21Z",
  "items": [
    {
      "candidate_ids": [
        "villepin"
      ],
      "feed": "liberation-politique",
      "published_at": "2026-10-23T12:44:37Z",
      "title": "Villepin dénonce l’amalgame entre LFI et ultragauche et défonce la «logique du bouc émissaire» du gouvernement",
      "url": "https://www.liberation.fr/politique/villepin-denonce-lamalgame-entre-lfi-et-ultragauche-et-defonce-la-logique-du-bouc-emissaire-du-gouvernement-20261023_PMICIJJWBNDLNBYZVBI7JE76NU/"
    },
    {
      "candidate_ids": [
        "lisnard"
      ],
      "feed": "franceinfo-politique",
      "published_at": "2026-10-23T13:07:58Z",
      "title": "Pourquoi le plateau de Millevaches est-il pointé du doigt comme un fief de l'ultragauche par certains politiques après l'incendie de la mairie de Limoges le 17 octobre ?",
      "url": "https://www.franceinfo.fr/societe/mobilisation-du-17-octobre/pourquoi-le-plateau-de-millevaches-est-il-pointe-du-doigt-comme-un-fief-de-l-ultragauche-par-certains-politiques-apres-l-incendie-de-la-mairie-de-limoges-le-17-octobre_8249275.html"
    }
  ],
  "schema_version": "1.0"
}
