{
  "feeds": [
    {
      "error": null,
      "id": "lemonde-presidentielle",
      "items": 20,
      "status": "ok"
    },
    {
      "error": null,
      "id": "lemonde-politique",
      "items": 20,
      "status": "ok"
    },
    {
      "error": null,
      "id": "lefigaro-politique",
      "items": 20,
      "status": "ok"
    },
    {
      "error": null,
      "id": "lefigaro-elections",
      "items": 20,
      "status": "ok"
    },
    {
      "error": null,
      "id": "liberation-politique",
      "items": 50,
      "status": "ok"
    },
    {
      "error": null,
      "id": "franceinfo-politique",
      "items": 20,
      "status": "ok"
    },
    {
      "error": null,
      "id": "franceinfo-presidentielle",
      "items": 20,
      "status": "ok"
    },
    {
      "error": null,
      "id": "bfmtv-politique",
      "items": 30,
      "status": "ok"
    },
    {
      "error": null,
      "id": "bfmtv-presidentielle",
      "items": 30,
      "status": "ok"
    },
    {
      "error": null,
      "id": "leparisien-politique",
      "items": 100,
      "status": "ok"
    },
    {
      "error": null,
      "id": "20minutes-politique",
      "items": 20,
      "status": "ok"
    },
    {
      "error": null,
      "id": "publicsenat",
      "items": 60,
      "status": "ok"
    },
    {
      "error": null,
      "id": "france24-france",
      "items": 30,
      "status": "ok"
    }
  ],
  "fetched_at": "2026-10-27T08:18:17Z",
  "items": [
    {
      "candidate_ids": [
        "philippe",
        "retailleau"
      ],
      "feed": "leparisien-politique",
      "published_at": null,
      "title": "« Le bilan est cataclysmique » : Bruno Retailleau se dit « persuadé » qu’il battrait Édouard Philippe en cas de primaire",
      "url": "https://www.leparisien.fr/elections/presidentielle/le-bilan-est-cataclysmique-bruno-retailleau-se-dit-persuade-quil-battrait-edouard-philippe-en-cas-de-primaire-27-10-2026-C4WGLTW4EFDQPKIL2JZBOUN7LE.php"
    }
  ],
  "schema_version": "1.0"
}
