{
  "feeds": [
    {
      "error": null,
      "id": "lemonde-presidentielle",
      "items": 20,
      "status": "ok"
    },
    {
      "error": null,
      "id": "lemonde-politique",
      "items": 20,
      "status": "ok"
    },
    {
      "error": null,
      "id": "lefigaro-politique",
      "items": 20,
      "status": "ok"
    },
    {
      "error": null,
      "id": "lefigaro-elections",
      "items": 20,
      "status": "ok"
    },
    {
      "error": null,
      "id": "liberation-politique",
      "items": 50,
      "status": "ok"
    },
    {
      "error": null,
      "id": "franceinfo-politique",
      "items": 20,
      "status": "ok"
    },
    {
      "error": null,
      "id": "franceinfo-presidentielle",
      "items": 20,
      "status": "ok"
    },
    {
      "error": null,
      "id": "bfmtv-politique",
      "items": 30,
      "status": "ok"
    },
    {
      "error": null,
      "id": "bfmtv-presidentielle",
      "items": 30,
      "status": "ok"
    },
    {
      "error": null,
      "id": "leparisien-politique",
      "items": 100,
      "status": "ok"
    },
    {
      "error": null,
      "id": "20minutes-politique",
      "items": 20,
      "status": "ok"
    },
    {
      "error": null,
      "id": "publicsenat",
      "items": 60,
      "status": "ok"
    },
    {
      "error": null,
      "id": "france24-france",
      "items": 30,
      "status": "ok"
    }
  ],
  "fetched_at": "2026-10-21T12:18:26Z",
  "items": [
    {
      "candidate_ids": [
        "le_pen"
      ],
      "feed": "franceinfo-politique",
      "published_at": "2026-10-21T12:06:25Z",
      "title": "Marine Le Pen a-t-elle déjà gagné la présidentielle ?",
      "url": "https://www.franceinfo.fr/politique/marine-le-pen/marine-le-pen-a-t-elle-deja-gagne-la-presidentielle_8247295.html"
    },
    {
      "candidate_ids": [
        "glucksmann",
        "melenchon",
        "ruffin",
        "tondelier"
      ],
      "feed": "bfmtv-politique",
      "published_at": "2026-10-21T11:48:52Z",
      "title": "Jean-Luc Mélenchon ou Raphaël Glucksmann: vers qui vont pencher les unitaires de gauche pour la présidentielle 2027?",
      "url": "https://www.bfmtv.com/politique/elections/presidentielle/jean-luc-melenchon-ou-raphael-glucksmann-vers-qui-vont-pencher-les-unitaires-de-gauche-pour-la-presidentielle-2027_AN-202610210527.html"
    }
  ],
  "schema_version": "1.0"
}
